<?xml version="1.0" encoding="UTF-8" ?>
<!DOCTYPE jeu SYSTEM "../jeu.dtd">
<jeu name="Counter-Strike" shortname="cs">
	<gametype nom="5 vs 5" type="Team" nbplayer="5" team1="T" team2="CT" round="2" minmaps="1" maxmaps="3" />
	<gametype nom="2 vs 2" type="Team" nbplayer="2" team1="T" team2="CT" round="2" minmaps="1" maxmaps="3" />
	<gametype nom="Duel" type="Duel" nbplayer="1" team1="T" team2="CT" round="2" minmaps="1" maxmaps="3" />
	<gametype nom="3 vs 3" type="Team" nbplayer="3" team1="T" team2="CT" round="2" minmaps="1" maxmaps="3" />
	<gametype nom="4 vs 4" type="Team" nbplayer="4" team1="T" team2="CT" round="2" minmaps="1" maxmaps="3" />
	<maps>
		<map nom="cs_747" image="maps/cs_747.jpg" />
		<map nom="cs_assault" image="maps/cs_assault.jpg" />
		<map nom="cs_havana" image="maps/cs_havana.jpg" />
		<map nom="cs_italy" image="maps/cs_italy.jpg" />
		<map nom="cs_militia" image="maps/cs_militia.jpg" />
		<map nom="cs_office" image="maps/cs_office.jpg" />
		<map nom="cs_siege" image="maps/cs_siege.jpg" />
		<map nom="de_aztec" image="maps/de_aztec.jpg" />
		<map nom="de_cbble" image="maps/de_cbble.jpg" />
		<map nom="de_dust" image="maps/de_dust.jpg" />
		<map nom="de_dust2" image="maps/de_dust2.jpg" />
		<map nom="de_inferno" image="maps/de_inferno.jpg" />
		<map nom="de_nuke" image="maps/de_nuke.jpg" />
		<map nom="de_piranesi" image="maps/de_piranesi.jpg" />
		<map nom="de_prodigy" image="maps/de_prodigy.jpg" />
		<map nom="de_train" image="maps/de_train.jpg" />
		<map nom="de_vertigo" image="maps/de_vertigo.jpg" />
	</maps>
</jeu>